{
  "$schema": "https://json-schema.org/draft/2020-12/schema",
  "$id": "https://aka.ms/sslz/schemas/postgresql-regional-plan-input.schema.json",
  "title": "SSLZ PostgreSQL regional planning input",
  "type": "object",
  "additionalProperties": false,
  "required": [
    "schemaVersion",
    "planId",
    "planningAt",
    "maxEvidenceAgeHours",
    "targetRegion",
    "allowedLocations",
    "requirements",
    "evidence"
  ],
  "properties": {
    "schemaVersion": { "const": "1.0.0" },
    "planId": { "$ref": "#/$defs/reference" },
    "planningAt": { "type": "string", "format": "date-time" },
    "maxEvidenceAgeHours": { "type": "integer", "minimum": 1, "maximum": 168 },
    "targetRegion": { "$ref": "#/$defs/region" },
    "allowedLocations": {
      "type": "array",
      "minItems": 1,
      "uniqueItems": true,
      "items": { "$ref": "#/$defs/region" }
    },
    "requirements": {
      "type": "object",
      "additionalProperties": false,
      "required": [
        "tier",
        "sku",
        "engineVersion",
        "extensions",
        "zoneRedundant",
        "minimumZones",
        "rtoMinutes",
        "rpoMinutes",
        "dataResidency",
        "monthlyCostCeiling"
      ],
      "properties": {
        "tier": { "enum": ["Burstable", "GeneralPurpose", "MemoryOptimized"] },
        "sku": { "$ref": "#/$defs/value" },
        "engineVersion": {
          "type": "object",
          "additionalProperties": false,
          "required": ["major", "minor"],
          "properties": {
            "major": { "type": "integer", "minimum": 11, "maximum": 99 },
            "minor": { "type": "integer", "minimum": 0, "maximum": 99 }
          }
        },
        "extensions": {
          "type": "array",
          "uniqueItems": true,
          "items": { "$ref": "#/$defs/value" }
        },
        "zoneRedundant": { "type": "boolean" },
        "minimumZones": { "type": "integer", "minimum": 1, "maximum": 3 },
        "rtoMinutes": { "type": "integer", "minimum": 0 },
        "rpoMinutes": { "type": "integer", "minimum": 0 },
        "dataResidency": { "$ref": "#/$defs/value" },
        "monthlyCostCeiling": { "type": "number", "minimum": 0 }
      }
    },
    "evidence": {
      "type": "array",
      "minItems": 1,
      "items": { "$ref": "#/$defs/evidence" }
    }
  },
  "$defs": {
    "reference": {
      "type": "string",
      "pattern": "^[a-z0-9][a-z0-9._:-]{2,127}$"
    },
    "region": {
      "type": "string",
      "pattern": "^[a-z][a-z0-9]{1,31}$"
    },
    "value": {
      "type": "string",
      "pattern": "^[A-Za-z0-9][A-Za-z0-9._-]{0,63}$"
    },
    "source": {
      "type": "object",
      "additionalProperties": false,
      "required": ["type", "reference", "observedAt", "expiresAt"],
      "properties": {
        "type": {
          "enum": ["azure-resource-provider", "azure-retail-prices", "approved-synthetic-fixture"]
        },
        "reference": { "$ref": "#/$defs/reference" },
        "observedAt": { "type": "string", "format": "date-time" },
        "expiresAt": { "type": "string", "format": "date-time" }
      }
    },
    "evidence": {
      "type": "object",
      "additionalProperties": false,
      "required": [
        "region",
        "preferenceRank",
        "serviceAvailability",
        "supportedEditions",
        "supportedVersions",
        "supportedExtensions",
        "zoneSupport",
        "quota",
        "capacity",
        "allowedByPolicy",
        "residencyBoundaries",
        "recovery",
        "estimatedMonthlyCost",
        "source"
      ],
      "properties": {
        "region": { "$ref": "#/$defs/region" },
        "preferenceRank": { "type": "integer", "minimum": 0 },
        "serviceAvailability": { "enum": ["available", "unavailable", "unknown"] },
        "supportedEditions": {
          "type": "array",
          "items": {
            "type": "object",
            "additionalProperties": false,
            "required": ["tier", "sku"],
            "properties": {
              "tier": { "enum": ["Burstable", "GeneralPurpose", "MemoryOptimized"] },
              "sku": { "$ref": "#/$defs/value" }
            }
          }
        },
        "supportedVersions": {
          "type": "array",
          "items": {
            "type": "object",
            "additionalProperties": false,
            "required": ["major", "minor"],
            "properties": {
              "major": { "type": "integer", "minimum": 11, "maximum": 99 },
              "minor": { "type": "integer", "minimum": 0, "maximum": 99 }
            }
          }
        },
        "supportedExtensions": {
          "type": "array",
          "uniqueItems": true,
          "items": { "$ref": "#/$defs/value" }
        },
        "zoneSupport": {
          "type": "object",
          "additionalProperties": false,
          "required": ["available", "zones"],
          "properties": {
            "available": { "type": "boolean" },
            "zones": {
              "type": "array",
              "uniqueItems": true,
              "items": { "type": "string", "pattern": "^[1-3]$" }
            }
          }
        },
        "quota": {
          "type": "object",
          "additionalProperties": false,
          "required": ["status", "required", "available", "unit"],
          "properties": {
            "status": { "enum": ["eligible", "shortage", "unknown"] },
            "required": { "type": "number", "minimum": 0 },
            "available": { "type": "number", "minimum": 0 },
            "unit": { "$ref": "#/$defs/value" }
          }
        },
        "capacity": {
          "type": "object",
          "additionalProperties": false,
          "required": ["status"],
          "properties": {
            "status": { "enum": ["available", "unavailable", "unknown"] }
          }
        },
        "allowedByPolicy": { "type": ["boolean", "null"] },
        "residencyBoundaries": {
          "type": "array",
          "uniqueItems": true,
          "items": { "$ref": "#/$defs/value" }
        },
        "recovery": {
          "type": "object",
          "additionalProperties": false,
          "required": ["minimumRtoMinutes", "minimumRpoMinutes"],
          "properties": {
            "minimumRtoMinutes": { "type": "integer", "minimum": 0 },
            "minimumRpoMinutes": { "type": "integer", "minimum": 0 }
          }
        },
        "estimatedMonthlyCost": { "type": "number", "minimum": 0 },
        "source": { "$ref": "#/$defs/source" }
      }
    }
  }
}
